{
  "schema_version": 3,
  "interaction_language": "zh-CN",
  "artifact_language": "zh-CN",
  "git": {
    "auto_commit": false,
    "default_branch": "main",
    "worktree_for_parallel": true
  },
  "execution": {
    "max_parallel": 3,
    "deep_ticket_human_approval": true,
    "shared_path_owner": "explicit"
  },
  "verification": {
    "test": "pnpm test",
    "typecheck": "pnpm typecheck",
    "lint": "pnpm lint",
    "build": "pnpm build"
  },
  "planning": {
    "default_depth": "standard",
    "require_ready_gate": true,
    "require_evidence": true
  }
}
